{
  "schemaVersion": 3,
  "name": "encodeSize",
  "layer": "user-facing",
  "domain": "encodings",
  "summary": "Encode point size as area; radius-normalized polygons use reference-circle area.",
  "signature": "encodeSize(options: TargetedOptions<SizeEncodingOptions | ConditionalEncodingOptions<SizeEncodingOptions>>): ChartProgram;",
  "intents": [
    "encode size",
    "encode",
    "map field",
    "visual encoding",
    "field mapping",
    "size",
    "quantitative size"
  ],
  "lifecycle": "Assignment",
  "resources": {
    "prerequisites": [
      "target mark",
      "field mode: dataset field"
    ],
    "owns": [
      "size assignment"
    ],
    "idOptions": [
      "target",
      "scale"
    ]
  },
  "authoringRoles": [
    "H2"
  ],
  "wraps": [
    "editSemantic",
    "createScale"
  ],
  "editableVia": [
    "removeEncoding"
  ],
  "supports": {
    "entryPoints": [
      "default",
      "basic"
    ]
  },
  "units": [],
  "inference": [
    {
      "input": "target",
      "strategy": "explicit-current-unique-or-error"
    },
    {
      "input": "scale",
      "strategy": "explicit-current-unique-or-error"
    }
  ],
  "completionRequirements": {
    "state": "contextual",
    "requires": [
      "target mark",
      "field mode: dataset field"
    ],
    "allowsEmpty": false
  },
  "options": [
    {
      "name": "target",
      "required": false,
      "type": "string | ActionTargetList | ScopedActionTarget | undefined"
    },
    {
      "name": "conditions",
      "required": false,
      "type": "ConditionalEncodingOptions<SizeEncodingOptions>[\"conditions\"]"
    },
    {
      "name": "otherwise",
      "required": false,
      "type": "ConditionalEncodingOptions<SizeEncodingOptions>[\"otherwise\"]"
    },
    {
      "name": "value",
      "required": false,
      "type": "number"
    },
    {
      "name": "field",
      "required": false,
      "type": "string"
    },
    {
      "name": "fieldType",
      "required": false,
      "type": "\"quantitative\" | undefined"
    },
    {
      "name": "scale",
      "required": false,
      "type": "SizeScaleOptions | undefined"
    }
  ],
  "callPatterns": [
    "encodeSize({ field, target?, fieldType?, scale? })",
    "encodeSize({ target?, conditions: [{ when, value }], otherwise })"
  ],
  "snippet": "program.encodeSize({ field: \"value\" })",
  "errors": [],
  "route": "/reference/actions/encodings/#encodesize"
}
