{
  "schemaVersion": 3,
  "name": "encodeYOffset",
  "layer": "user-facing",
  "domain": "encodings",
  "summary": "Create or compatibly update the corresponding categorical offset scale within a bar, point, or rule y category.",
  "signature": "encodeYOffset(options: TargetedOptions<YOffsetEncodingOptions | ConditionalEncodingOptions<YOffsetEncodingOptions>>): ChartProgram;",
  "intents": [
    "encode y offset",
    "encode",
    "map field",
    "visual encoding",
    "field mapping",
    "y offset",
    "grouped vertical offset"
  ],
  "lifecycle": "Assignment",
  "resources": {
    "prerequisites": [
      "target mark",
      "field mode: dataset field"
    ],
    "owns": [
      "y offset assignment"
    ],
    "idOptions": [
      "target",
      "scale"
    ]
  },
  "authoringRoles": [
    "H2"
  ],
  "wraps": [
    "editSemantic",
    "createScale",
    "layoutSeries",
    "editScale"
  ],
  "editableVia": [
    "removeEncoding"
  ],
  "supports": {
    "entryPoints": [
      "default",
      "basic"
    ]
  },
  "units": [
    {
      "path": "paddingInner",
      "unit": "band-fraction"
    },
    {
      "path": "paddingOuter",
      "unit": "band-fraction"
    }
  ],
  "inference": [
    {
      "input": "target",
      "strategy": "explicit-current-unique-or-error"
    },
    {
      "input": "scale",
      "strategy": "explicit-current-unique-or-error"
    }
  ],
  "completionRequirements": {
    "state": "contextual",
    "requires": [
      "target mark",
      "field mode: dataset field"
    ],
    "allowsEmpty": false
  },
  "options": [
    {
      "name": "target",
      "required": false,
      "type": "string | ActionTargetList | ScopedActionTarget | undefined"
    },
    {
      "name": "conditions",
      "required": false,
      "type": "ConditionalEncodingOptions<YOffsetEncodingOptions>[\"conditions\"]"
    },
    {
      "name": "otherwise",
      "required": false,
      "type": "ConditionalEncodingOptions<YOffsetEncodingOptions>[\"otherwise\"]"
    },
    {
      "name": "field",
      "required": false,
      "type": "string"
    },
    {
      "name": "fieldType",
      "required": false,
      "type": "\"nominal\" | \"ordinal\" | undefined"
    },
    {
      "name": "scale",
      "required": false,
      "type": "OffsetScaleOptions | undefined"
    },
    {
      "name": "paddingInner",
      "required": false,
      "type": "number | undefined"
    },
    {
      "name": "paddingOuter",
      "required": false,
      "type": "number | undefined"
    }
  ],
  "callPatterns": [
    "encodeYOffset({ target?, scale?, conditions?, otherwise?, field?, fieldType?, paddingInner?, paddingOuter? })"
  ],
  "snippet": "program.encodeYOffset({ field: \"series\" })",
  "errors": [],
  "route": "/reference/actions/encodings/#encodeyoffset"
}
