{
  "schemaVersion": 3,
  "name": "createDotPlot",
  "layer": "user-facing",
  "domain": "charts",
  "summary": "Create categorical dots from raw rows by default.",
  "signature": "createDotPlot(options: TargetedOptions<CreateDotPlotOptions>): ChartProgram;",
  "intents": [
    "create dot plot",
    "create",
    "add",
    "complete chart",
    "chart facade",
    "dot plot",
    "categorical dots"
  ],
  "lifecycle": "Mutable resource",
  "resources": {
    "prerequisites": [
      "canvas and dataset context"
    ],
    "owns": [
      "dot plot"
    ],
    "idOptions": [
      "id",
      "data",
      "coordinate",
      "target"
    ]
  },
  "authoringRoles": [
    "H0",
    "H1"
  ],
  "wraps": [
    "createSummaryData",
    "createPointMark",
    "encodeX",
    "encodeY"
  ],
  "editableVia": [
    "editEndpointPlot"
  ],
  "supports": {
    "entryPoints": [
      "default"
    ]
  },
  "units": [],
  "inference": [
    {
      "input": "data",
      "strategy": "explicit-current-unique-or-error"
    },
    {
      "input": "coordinate",
      "strategy": "explicit-current-unique-or-error"
    },
    {
      "input": "target",
      "strategy": "explicit-current-unique-or-error"
    },
    {
      "input": "omitted optional options",
      "strategy": "documented-default"
    }
  ],
  "completionRequirements": {
    "state": "complete",
    "requires": [
      "canvas and dataset context"
    ],
    "allowsEmpty": false
  },
  "options": [
    {
      "name": "value",
      "required": true,
      "type": "EndpointValueChannel"
    },
    {
      "name": "point",
      "required": false,
      "type": "(StrokeStyleDetails & { clip?: boolean | undefined; radius?: number | undefined; shape?: PointShape | undefined; fill?: string | undefined; opacity?: number | undefined; stroke?: FilledMarkStroke | undefined; strokeWidth?: number | undefined; }) | undefined"
    },
    {
      "name": "labels",
      "required": false,
      "type": "false | EndpointLabelOptions | undefined"
    },
    {
      "name": "missing",
      "required": false,
      "type": "\"error\" | \"skip\" | undefined"
    },
    {
      "name": "id",
      "required": false,
      "type": "string | undefined"
    },
    {
      "name": "data",
      "required": false,
      "type": "string | undefined"
    },
    {
      "name": "coordinate",
      "required": false,
      "type": "string | undefined"
    },
    {
      "name": "category",
      "required": true,
      "type": "EndpointCategoryChannel"
    },
    {
      "name": "orientation",
      "required": false,
      "type": "\"horizontal\" | \"vertical\" | undefined"
    },
    {
      "name": "summary",
      "required": false,
      "type": "EndpointPlotSummary | undefined"
    },
    {
      "name": "guides",
      "required": false,
      "type": "false | CartesianSeparateGuideOptions | undefined"
    },
    {
      "name": "target",
      "required": false,
      "type": "ActionTargetList | ScopedActionTarget"
    }
  ],
  "callPatterns": [
    "createDotPlot({ category, value })",
    "createDotPlot({ category, value, orientation?, summary?, point?, labels?, guides? })"
  ],
  "snippet": "program.createDotPlot({ category: \"category\", value: \"value\" })",
  "errors": [],
  "route": "/reference/actions/charts-data/#createdotplot"
}
