{
  "schemaVersion": 3,
  "name": "editFacetGuides",
  "layer": "user-facing",
  "domain": "composition",
  "summary": "Partially change axes between \"each\" and \"outer\", or legend ownership between false and \"shared\".",
  "signature": "editFacetGuides(options: FacetGuideOptions): ChartProgram;",
  "intents": [
    "edit facet guides",
    "edit",
    "change",
    "chart composition",
    "small multiples",
    "facet guides",
    "outer axes and shared legends"
  ],
  "lifecycle": "Mutable resource",
  "resources": {
    "prerequisites": [
      "existing facet guides",
      "complete child chart program"
    ],
    "owns": [],
    "idOptions": []
  },
  "authoringRoles": [
    "H3"
  ],
  "wraps": [],
  "editableVia": [
    "editFacetGuides"
  ],
  "supports": {
    "entryPoints": [
      "default"
    ]
  },
  "units": [],
  "inference": [],
  "completionRequirements": {
    "state": "contextual",
    "requires": [
      "existing facet guides",
      "complete child chart program"
    ],
    "allowsEmpty": false
  },
  "options": [
    {
      "name": "axes",
      "required": false,
      "type": "\"each\" | \"outer\" | { x?: \"each\" | \"outer\" | undefined; y?: \"each\" | \"outer\" | undefined; } | undefined"
    },
    {
      "name": "legend",
      "required": false,
      "type": "\"shared\" | false | LegendOptions | undefined"
    }
  ],
  "callPatterns": [
    "editFacetGuides({ axes?, legend? })"
  ],
  "snippet": "program.editFacetGuides({ axes: \"each\" })",
  "errors": [],
  "route": "/reference/actions/charts-data/#editfacetguides"
}
