{
  "schemaVersion": 3,
  "name": "fitCanvas",
  "layer": "user-facing",
  "domain": "core",
  "summary": "Fit an existing Full unit chart by shrinking its margins on a fixed Canvas.",
  "signature": "fitCanvas(options?: TargetedOptions<FitCanvasOptions>): ChartProgram;",
  "intents": [
    "fit canvas",
    "layout",
    "avoid overlap",
    "chart setup",
    "data and scales",
    "canvas",
    "chart size"
  ],
  "lifecycle": "Mutable resource",
  "resources": {
    "prerequisites": [
      "existing canvas"
    ],
    "owns": [
      "canvas"
    ],
    "idOptions": [
      "target"
    ]
  },
  "authoringRoles": [
    "H3"
  ],
  "wraps": [
    "editCanvas"
  ],
  "editableVia": [
    "fitCanvas"
  ],
  "supports": {
    "entryPoints": [
      "default"
    ]
  },
  "units": [
    {
      "path": "padding",
      "unit": "logical-pixel"
    },
    {
      "path": "minPlotWidth",
      "unit": "logical-pixel"
    },
    {
      "path": "minPlotHeight",
      "unit": "logical-pixel"
    }
  ],
  "inference": [
    {
      "input": "target",
      "strategy": "explicit-current-unique-or-error"
    }
  ],
  "completionRequirements": {
    "state": "contextual",
    "requires": [
      "existing canvas"
    ],
    "allowsEmpty": false
  },
  "options": [
    {
      "name": "align",
      "required": false,
      "type": "\"center\" | \"preserve\" | undefined"
    },
    {
      "name": "padding",
      "required": false,
      "type": "number | undefined"
    },
    {
      "name": "minPlotWidth",
      "required": false,
      "type": "number | undefined"
    },
    {
      "name": "minPlotHeight",
      "required": false,
      "type": "number | undefined"
    },
    {
      "name": "iterationLimit",
      "required": false,
      "type": "number | undefined"
    },
    {
      "name": "overflow",
      "required": false,
      "type": "\"error\" | \"report\" | undefined"
    },
    {
      "name": "target",
      "required": false,
      "type": "ActionTargetList | ScopedActionTarget"
    }
  ],
  "callPatterns": [
    "fitCanvas({ target?, align?, padding?, minPlotWidth?, minPlotHeight?, iterationLimit?, overflow? })"
  ],
  "snippet": "program.fitCanvas({ align: \"center\" })",
  "errors": [],
  "route": "/reference/actions/charts-data/#fitcanvas"
}
