{
  "schemaVersion": 3,
  "name": "createTitle",
  "layer": "user-facing",
  "domain": "legend_and_title",
  "summary": "Create a chart title and optional subtitle.",
  "signature": "createTitle(options: TitleOptions): ChartProgram;",
  "intents": [
    "create title",
    "create",
    "add",
    "legend or title",
    "chart annotation",
    "chart title",
    "title and subtitle"
  ],
  "lifecycle": "Mutable resource",
  "resources": {
    "prerequisites": [],
    "owns": [
      "chart title"
    ],
    "idOptions": []
  },
  "authoringRoles": [
    "H3"
  ],
  "wraps": [
    "editSemantic"
  ],
  "editableVia": [
    "editTitle"
  ],
  "supports": {
    "entryPoints": [
      "default"
    ]
  },
  "units": [
    {
      "path": "offset",
      "unit": "logical-pixel"
    },
    {
      "path": "alongOffset",
      "unit": "logical-pixel"
    },
    {
      "path": "maxWidth",
      "unit": "logical-pixel"
    },
    {
      "path": "lineHeight",
      "unit": "logical-pixel"
    }
  ],
  "inference": [
    {
      "input": "omitted optional options",
      "strategy": "documented-default"
    }
  ],
  "completionRequirements": {
    "state": "contextual",
    "requires": [],
    "allowsEmpty": false
  },
  "options": [
    {
      "name": "text",
      "required": true,
      "type": "string"
    },
    {
      "name": "subtitle",
      "required": false,
      "type": "string | undefined"
    },
    {
      "name": "position",
      "required": false,
      "type": "\"bottom\" | \"left\" | \"right\" | \"top\" | undefined"
    },
    {
      "name": "align",
      "required": false,
      "type": "\"center\" | \"left\" | \"right\" | undefined"
    },
    {
      "name": "offset",
      "required": false,
      "type": "number | undefined"
    },
    {
      "name": "alongOffset",
      "required": false,
      "type": "number | undefined"
    },
    {
      "name": "gap",
      "required": false,
      "type": "number | undefined"
    },
    {
      "name": "maxWidth",
      "required": false,
      "type": "number | undefined"
    },
    {
      "name": "wrap",
      "required": false,
      "type": "\"character\" | \"word\" | undefined"
    },
    {
      "name": "lineHeight",
      "required": false,
      "type": "number | undefined"
    },
    {
      "name": "titleStyle",
      "required": false,
      "type": "TitleTextStyleOptions | undefined"
    },
    {
      "name": "subtitleStyle",
      "required": false,
      "type": "TitleTextStyleOptions | undefined"
    }
  ],
  "callPatterns": [
    "createTitle({ text, subtitle?, position?, align?, offset?, alongOffset?, gap?, maxWidth? })"
  ],
  "snippet": "program.createTitle({ text: \"Chart title\" })",
  "errors": [],
  "route": "/reference/actions/guides/#createtitle"
}
