{
  "schemaVersion": 3,
  "name": "createNormalizedData",
  "layer": "user-facing",
  "domain": "statistics",
  "summary": "Materialize row-preserving share, z-score, min-max, index, change, or fractional percent-change values independently within each group.",
  "signature": "createNormalizedData(options: TargetedOptions<NormalizedDataOptions>): ChartProgram;",
  "intents": [
    "create normalized data",
    "create",
    "add",
    "statistical layer",
    "statistical transform",
    "normalized data",
    "group shares and baseline comparisons"
  ],
  "lifecycle": "Mutable resource",
  "resources": {
    "prerequisites": [
      "source dataset"
    ],
    "owns": [
      "normalized data"
    ],
    "idOptions": [
      "id",
      "source",
      "target"
    ]
  },
  "authoringRoles": [
    "H1"
  ],
  "wraps": [
    "createDerivedData"
  ],
  "editableVia": [
    "editNormalizedData"
  ],
  "supports": {
    "entryPoints": [
      "default"
    ]
  },
  "units": [],
  "inference": [
    {
      "input": "source",
      "strategy": "explicit-current-unique-or-error"
    },
    {
      "input": "target",
      "strategy": "explicit-current-unique-or-error"
    },
    {
      "input": "omitted optional options",
      "strategy": "documented-default"
    }
  ],
  "completionRequirements": {
    "state": "contextual",
    "requires": [
      "source dataset"
    ],
    "allowsEmpty": false
  },
  "options": [
    {
      "name": "id",
      "required": true,
      "type": "string"
    },
    {
      "name": "source",
      "required": false,
      "type": "string | undefined"
    },
    {
      "name": "field",
      "required": true,
      "type": "string"
    },
    {
      "name": "as",
      "required": true,
      "type": "string"
    },
    {
      "name": "groupBy",
      "required": false,
      "type": "string | readonly string[] | undefined"
    },
    {
      "name": "method",
      "required": true,
      "type": "\"change\" | \"index\" | \"minmax\" | \"percentChange\" | \"share\" | \"zscore\""
    },
    {
      "name": "zeroDenominator",
      "required": false,
      "type": "NormalizeZeroDenominator | undefined"
    },
    {
      "name": "variance",
      "required": false,
      "type": "\"population\" | \"sample\" | undefined"
    },
    {
      "name": "baseline",
      "required": false,
      "type": "{ position: \"first\" | \"last\"; } | undefined"
    },
    {
      "name": "sortBy",
      "required": false,
      "type": "readonly [WindowSort, ...WindowSort[]]"
    },
    {
      "name": "target",
      "required": false,
      "type": "ActionTargetList | ScopedActionTarget"
    }
  ],
  "callPatterns": [
    "createNormalizedData({ id, field, as, method, source?, target?, groupBy?, zeroDenominator? })"
  ],
  "snippet": "program.createNormalizedData({ id: \"normalized\", field: \"amount\", as: \"share\", method: \"share\" })",
  "errors": [],
  "route": "/reference/actions/statistics/#createnormalizeddata"
}
