{
  "schemaVersion": 3,
  "name": "editThetaScale",
  "layer": "user-facing",
  "domain": "core",
  "summary": "Edits theta scale, including settings for angular position mapping.",
  "signature": "editThetaScale(options: TargetedOptions<EditThetaScaleOptions>): ChartProgram;",
  "intents": [
    "edit theta scale",
    "edit",
    "change",
    "chart setup",
    "data and scales",
    "theta scale",
    "angular position mapping"
  ],
  "lifecycle": "Mutable resource",
  "resources": {
    "prerequisites": [
      "existing theta scale"
    ],
    "owns": [],
    "idOptions": [
      "id",
      "target"
    ]
  },
  "authoringRoles": [
    "H2"
  ],
  "wraps": [
    "editScale"
  ],
  "editableVia": [
    "editThetaScale",
    "editScale"
  ],
  "supports": {
    "entryPoints": [
      "default"
    ]
  },
  "units": [
    {
      "path": "paddingInner",
      "unit": "band-fraction"
    },
    {
      "path": "paddingOuter",
      "unit": "band-fraction"
    },
    {
      "path": "padding",
      "unit": "band-fraction"
    },
    {
      "path": "align",
      "unit": "ratio"
    }
  ],
  "inference": [
    {
      "input": "target",
      "strategy": "explicit-current-unique-or-error"
    },
    {
      "input": "domain",
      "strategy": "documented-auto"
    },
    {
      "input": "range",
      "strategy": "documented-auto"
    }
  ],
  "completionRequirements": {
    "state": "contextual",
    "requires": [
      "existing theta scale"
    ],
    "allowsEmpty": false
  },
  "options": [
    {
      "name": "id",
      "required": false,
      "type": "string | undefined"
    },
    {
      "name": "target",
      "required": false,
      "type": "string | ActionTargetList | ScopedActionTarget | undefined"
    },
    {
      "name": "type",
      "required": false,
      "type": "\"band\" | \"linear\" | \"point\" | \"time\" | undefined"
    },
    {
      "name": "domain",
      "required": false,
      "type": "\"auto\" | readonly unknown[] | undefined"
    },
    {
      "name": "range",
      "required": false,
      "type": "\"auto\" | readonly [number, number] | undefined"
    },
    {
      "name": "nice",
      "required": false,
      "type": "boolean | undefined"
    },
    {
      "name": "zero",
      "required": false,
      "type": "boolean | undefined"
    },
    {
      "name": "clamp",
      "required": false,
      "type": "boolean | undefined"
    },
    {
      "name": "reverse",
      "required": false,
      "type": "boolean | undefined"
    },
    {
      "name": "paddingInner",
      "required": false,
      "type": "number | undefined"
    },
    {
      "name": "paddingOuter",
      "required": false,
      "type": "number | undefined"
    },
    {
      "name": "padding",
      "required": false,
      "type": "number | undefined"
    },
    {
      "name": "align",
      "required": false,
      "type": "number | undefined"
    }
  ],
  "callPatterns": [
    "editThetaScale({ id?, target?, type?, domain?, range?, nice?, zero?, clamp? })"
  ],
  "snippet": "program.editThetaScale({ reverse: true })",
  "errors": [],
  "route": "/reference/actions/charts-data/#editthetascale"
}
